comment_id,author,text,time,time_parsed,likes,is_reply,parent_id,scraped_at
UgyAX6qGD9qhe9ypmlV4AaABAg,@CoteDivoireMakingof,I think the 13 Pro max is the greatest IPhone ever made,5 months ago,1759593213.987045,0,False,,2026-03-04 21:23:33
Ugx3pkSWKMOcJMZyRT94AaABAg,@ashu0102,"Thinking of upgrading from iphone XS MAX which one should i go for 16 pro max or 17 pro max....?
I am afraid that apple will downgrade speakers after 1 year, and also bettery degrades faster than android competitor.",5 months ago,1759593213.992198,0,False,,2026-03-04 21:23:33
Ugz6T_VS7LX1QHcF0194AaABAg,@Hater4Life85,Iphone 5s users gather up,5 months ago,1759593213.996428,0,False,,2026-03-04 21:23:33
UgzJ6mbHJJFqodcTCfd4AaABAg,@DavidMulwa-t2j,Wow this video recorded with this phone,5 months ago,1759593214.000237,0,False,,2026-03-04 21:23:34
UgxIJCkpeBXI--VPgG14AaABAg,@oklagrowmie5587,I have a 12 pro max. What about me:P,5 months ago,1759593214.004439,0,False,,2026-03-04 21:23:34
UgwXXL1APFMmxRePT_94AaABAg,@power279,Iphone 17.. Less durable than last time😂,5 months ago,1759593214.401074,0,False,,2026-03-04 21:23:34
UgxiZFnUlT5nZ8WZ9uJ4AaABAg,@OwainJones-hk8yn,Im watching this YouTube video in 2k,5 months ago,1759593214.406036,0,False,,2026-03-04 21:23:34
Ugz_5J0FsRoSAMpPJwF4AaABAg,@OwainJones-hk8yn,Guys now think about the iPhone 18,5 months ago,1759593214.410845,0,False,,2026-03-04 21:23:34
UgwFn8XlRIQ4Mc3aEIB4AaABAg,@tricky4amit,XS Max for the win 🏆,5 months ago,1759593214.415787,0,False,,2026-03-04 21:23:34
Ugww78edQ2QqxGvKPWR4AaABAg,@danieln6700,Crazy ppl go from a 16 to a 17. Never owned an iPhone but they are so expensive it's crazy,5 months ago,1759593214.420954,0,False,,2026-03-04 21:23:34
UgyhhtW8tZFrsX6y_r54AaABAg,@ShotsOfTech,Considering that the first ever base model iphone that has 120hz (iphone 17) cost $1k+ (AUD) and a 120hz samsung phone can cost $549 (AUD),5 months ago (edited),1759593214.425944,1,False,,2026-03-04 21:23:34
UgwT36v81iZDtemgKDV4AaABAg,@MajemiteEmmanuel,Iphone 11 pro max gather here lol,5 months ago,1759593214.430224,0,False,,2026-03-04 21:23:34
UgyiB_sKKYYiHYQumVV4AaABAg,@tomaszprzetacznik7802,"My question is, who and why decided that the iPhone Pro (which is the flagship model) is only available in the horrible tic-tac color or the orange garbage-truck shade, in a silver-white version (if it were fully silver it would be fine, but it’s not), and in navy blue. There’s no black, graphite, or gray option, nor the mentioned uniform silver. Recently Apple has been struggling with color consistency across its products—for example, the iPhone Pro comes in completely different colors than the MacBook Pro, the keyboard is only silver with black keys, while the mouse is either white or black. Apple displays (I have a Studio Display) are only silver. The Studio Display has matched the Mac Studio since its release, but what about the rest of the peripherals and the flagship iPhone Pro?

It’s never good when design is decided by marketing team…
Shane on you Evans Hankaey
I am really starting to miss Jony Ive!",5 months ago,1759593214.435316,0,False,,2026-03-04 21:23:34
UgxH6B7Vxj1AXshJBbh4AaABAg,@ashfinashraf3089,What’s the game he’s playing,5 months ago,1759593214.441034,0,False,,2026-03-04 21:23:34
Ugx-6M5k9zAOkTWydLR4AaABAg,@realiascailt,"7:20 they finally fixed it. Back in 2019 my friend bought the iPhone 11 and every time we were on a FaceTime call, I couldn't hear him. 6 years later and Apple did something about it 😂",5 months ago,1759593214.445084,1,False,,2026-03-04 21:23:34
UgwwcomR5AssOLKKTjt4AaABAg,@conors4430,"Consider me stumped, but I don’t know how the video starts with. This phone isn’t special and Apple hasn’t demonstrated a good use case for it, and then the next logical jump is, but it’s coming, oh it’s definitely coming. Yeah, I might be cynical  but maybe, just maybe. It’s not. But the fanboys can’t bring themselves to not part with $2000 every year for the same thing.",5 months ago,1759593214.449724,0,False,,2026-03-04 21:23:34
Ugwh12lZJVcnthpkN_B4AaABAg,@HyperHrishiHD,iPhone 13 series users reply 😅,5 months ago,1759593214.453566,0,False,,2026-03-04 21:23:34
UgydL9yJZZT75qF7NkB4AaABAg,@Matapagi,I challenge you to do camera comparison between IPhone 17 Pro Max vs Vivo X200!!! 🧐,5 months ago (edited),1759593214.458743,1,False,,2026-03-04 21:23:34
UgwqIMiLrkQv8xxA3P54AaABAg,@whophd,"2:46 photographing signs and writing is always ""a special case"" — which you can prove by the fact that the ""Definition"" filter is mostly useless EXCEPT in those photos.",5 months ago,1759593214.463395,0,False,,2026-03-04 21:23:34
UgzfTxJ6p7M-F61b_BF4AaABAg,@TestMIDI,why is the video so small. Literally,5 months ago,1759593214.469142,0,False,,2026-03-04 21:23:34
Ugw0ywHdONTHCYTZG8J4AaABAg,@Bharathsimhareddyellanki,Never buy a product which promises features later down the line why buy it when it is offering nothing new and for higher price compared to phones with same features that came in year ago. why make a phone slimmer by decreasing battery and features only to get a magsafe battery which makes it thicker than phone with similar battery life,5 months ago,1759593214.474137,0,False,,2026-03-04 21:23:34
UgyefzgW_Xq_v4rCi3h4AaABAg,@whophd,"2:02 I'm confused … why is that better?  I mean it's nice to have the choice … but zooming out and darkening the midtones has always been easy?  Right?  The previous video at 2:01 looks more ""present"" and with you.  The face feels real and like it's there in real life, not on a screen.",5 months ago (edited),1759593214.477595,0,False,,2026-03-04 21:23:34
UgyNgtlZVNtDKWyTiMV4AaABAg,@prathameshektare1447,"I think what’s most reviewers are ignoring are the sales numbers of base v Pro. The Pro and Pro Max have outsold the base iPhone for years now. It’s not only for power users. So, while logically 90% of people should buy a base iPhone, only half of them actually. The rest are buying Pros.",5 months ago,1759593214.480636,1,False,,2026-03-04 21:23:34
Ugz6ZqqxzL9PqtoM7IZ4AaABAg,@julien5664,"My iPhone 15 pro max heats up and I like playing games on it mobile style lol Roblox, Minecraft, puzzle games and simple stuff even if I lower the graphics on any of them very very low. And the fact it overheats causes the screen to dim so much and I literally can’t use it at all outside of its hot and I live in a very hot state. I’m kind of tired of it plus the overheating causes faster battery degradation and it sucks. Which is why I’m happ T-Mobile and most carriers are offering 24 months for a loan depending on your type of coverage. And I would only have to pay 99 dollars over a course of 24 months. As long as I don’t pay it off early. Which is fine for me since I like upgrading every two years. Minimum. Plus I think there’s enough other small features that makes me happy. If they had a 17 plus would’ve make me happy tbh but they didn’t go through with it this year. I love that sage color green is my favorite color and I’m happy that they offer many of the features across all devices in this series with good power and battery. I’m sad the air took the place of the plus model this year.",5 months ago,1759593214.48411,0,False,,2026-03-04 21:23:34
Ugw76k3YfiahgYv3kAJ4AaABAg,@rfm_gade,I have the iPhone 13 now and gonna change to the 17pro… think for me it’s gonna be a great upgrade,5 months ago,1759593214.487261,0,False,,2026-03-04 21:23:34
UgyefzgW_Xq_v4rCi3h4AaABAg.ANPG0BnxbDsANWJu5DM5XZ,@saadjameel1820,"Exactly my thought, not the best comparison 😅",5 months ago,1759593214.796028,0,True,,2026-03-04 21:23:34
Ugz6ZqqxzL9PqtoM7IZ4AaABAg.ANPFfa3W5J6ANPFpwf4p8M,@julien5664,I have 940 cycles and like 85% maximum capacity but that’s due to how often I charge it and use games on it and use my phone. And how often I have to charge it….i think pro max is the best for me I have huge hands too sadly so anything smaller feels less then ideal trust me I tried holding the 17 recently and it’s way too small.,5 months ago,1759593215.093827,0,True,,2026-03-04 21:23:35
Ugx3ymaiYdVTXmHiR5N4AaABAg,@aravindvenu1560,Scratch resistance have increased substantially. JerryRigEverything scratch test showed no scratches at level 6 with no deeper grooves at level 7!😮,5 months ago,1759593215.492455,1,False,,2026-03-04 21:23:35
UgwNu9MEXryqEet30Sp4AaABAg,@Sub2R3LV0,"4:28 when I click off one of my contacts in iMessage it only shows abt 8 contacts for a second 
I know how fix it btw
1.u get google photos
2.u buy an android 
3. Get google photos and u have ur photos and no messages problem :)",5 months ago,1759593215.496438,0,False,,2026-03-04 21:23:35
UgyqC1IWLv3uY9AzUVR4AaABAg,@SXZFIRE,im going from iPhone 12 Pro to iPhone 17 pro max or air or pro idk,5 months ago,1759593215.499508,0,False,,2026-03-04 21:23:35
Ugz5DLVNbXgkgJA3WSZ4AaABAg,@abdulrhmanalmofadda6793,"It's an iPhone..
It has apps and a camera 
Innovation is overrated 😂",5 months ago,1759593215.502955,0,False,,2026-03-04 21:23:35
Ugx1EjrPEgrWZA4JCg94AaABAg,@Hinoki_Weitzel,"Going from last gen to 17 it’s a night and day difference for me, imo biggest jump in performance across the board since the iPhone 8 to x . Crazy difference in gaming , cell service, cameras especially low light, and screen",5 months ago,1759593215.506238,0,False,,2026-03-04 21:23:35
UgwmQJt8zdmEtLWHh694AaABAg,@masiniculucipopa,XS MAX GANG WHERE U AT?,5 months ago,1759593215.509973,0,False,,2026-03-04 21:23:35
UgzBjBmXm4zq9wseWDV4AaABAg,@ashmulchandani1722,I wanna know where I can buy that copper coloured cup ?,5 months ago,1759593215.512781,0,False,,2026-03-04 21:23:35
Ugw2N0PKjBgKbR2ba754AaABAg,@ErikTheBear,How do u get 1.4m views in 14 hours…… insane,5 months ago (edited),1759593215.515314,4,False,,2026-03-04 21:23:35
UgzlcacFzEXrEyKLkjl4AaABAg,@slacktoryrecords4193,"What happens when you take a photo in “less than optimal” lighting? Does it do that infernal auto-“enhancing” where it brightens the photo and DNRs it against your will, with no going back? God I am SO SICK OF MY iPHONE DOING THAT",5 months ago,1759593215.518694,0,False,,2026-03-04 21:23:35
UgxpyfS3Q-QoqGLv3G14AaABAg,@alain-danieltankwa8007,"I take your opinion for most gadgets. But for 2 years now, I've noticed you're iPhone biased",5 months ago,1759593215.5212,0,False,,2026-03-04 21:23:35
Ugz-Hs6QNwWf8HUDAat4AaABAg,@RapBoySh,They are so concentrated on hardware because they are failing on the software front,5 months ago,1759593215.524358,0,False,,2026-03-04 21:23:35
UgxnHw1OCVkhyH4J_wx4AaABAg,@RealRedoxyt,Whenever i watch a iPhone 17 video i get iPhone 17 ads 😂😂😂😂😂😂😂 lol,5 months ago,1759593215.526884,0,False,,2026-03-04 21:23:35
UgxkjTjZqaWcfwecGLJ4AaABAg,@kaiperdaens7670,"2:36 The phone switches the camera when it wants?
Bro that is not normal, when I select 4x or more it's BC I want to use that camera so don't switch it for me.",5 months ago,1759593216.563876,1,False,,2026-03-04 21:23:36
UgyJkN1R9KAtq8nmwfp4AaABAg,@csongor_radai,(4K ProRes RAW takes many times more performance than recording normal 8K if you are curious).,5 months ago,1759593216.568859,1,False,,2026-03-04 21:23:36
UgxgUFQej_cPVINgnFx4AaABAg,@kaiperdaens7670,Bro's titles on iPhone videos make it seem like he is gonna point out some negatives but then he just glazes the phone fo the whole video,5 months ago,1759593216.572602,2,False,,2026-03-04 21:23:36
UgxJf_H5xuWplcP4uit4AaABAg,@kaiperdaens7670,How many more apple glaze videos is he gonna make 🙏🙏,5 months ago,1759593216.575282,2,False,,2026-03-04 21:23:36
UgyPJXSmtXyqHA27gpx4AaABAg,@sifelicious,"i think i know all the features and all details about this phone but i still clicked on this video to watch it , just because i enjoy his production value.

always good videos! ( NERDY Yet COOL )",5 months ago,1759593216.579439,0,False,,2026-03-04 21:23:36
Ugxa1kWmLgJEVewbAkN4AaABAg,@MusyabbirHaqim,Arun hope you review the Xiaomi 17 pro once it launch later in the upcoming month.,5 months ago,1759593216.582302,0,False,,2026-03-04 21:23:36
Ugxw8b3A9bmEdoPPiW14AaABAg,@shaficscosuraj6941,"Frankly speaking, the  iPhone 17 pro models for this has the worst build quality indeed prone to scratches 😢",5 months ago,1759593216.584976,2,False,,2026-03-04 21:23:36
UgzToLcyq6AzGc8h1ZZ4AaABAg,@RiteshShetty-m3u,Review Honor V5,5 months ago,1759593216.589594,0,False,,2026-03-04 21:23:36
Ugx1EjrPEgrWZA4JCg94AaABAg.ANPEyK8komvANPjC444wFU,@kenmastersmaster,Delusional the camera sensors are exactly the same since iPhone 14 pro to present. Minor changes in software and no difference in gaming AnTuTu scores are like 10% higher,5 months ago,1759593216.926615,0,True,,2026-03-04 21:23:36
Ugx1EjrPEgrWZA4JCg94AaABAg.ANPEyK8komvANPuFhSqppT,@Hinoki_Weitzel," @kenmastersmaster  haha idk where you get your info but a simple google search says otherwise. Sideby side with my iphone 16, huge difference. In fortnite my iphone 16 promax gets 60 fps decently with highest settings, but the 17 promax gets 120 max settings no frame drops super smooth. Better than my $2000 4070 laptop!  Insane. Also the camera sensors are completely different. First time to get 48p across the board, every iphone before this only gort 48mp in the main shooter. Do youre research first please before yapping lol",5 months ago,1759593216.929492,0,True,,2026-03-04 21:23:36
UgwmQJt8zdmEtLWHh694AaABAg.ANPEjkeXOOvANPtRX6hU5f,@henringuembi,Just here,5 months ago,1759593217.715375,0,True,,2026-03-04 21:23:37
Ugw2N0PKjBgKbR2ba754AaABAg.ANPDaLkNDhFAOSkDBQhDUU,@echelon_67,Because he has 21 million subscribers?,4 months ago,1762271618.024946,0,True,,2026-03-04 21:23:38
UgxgUFQej_cPVINgnFx4AaABAg.ANPB41baGHgANPKiqgopI6,@tyronemguni3895,"So you didn’t hear him talk about the bugs? How its scratch resistance is horrible on the coating? Or how apple was making subjective claims on the scratch resistance of the screens? 

Jesus , he’s just not rude about the defects, he’s just a nice guy but he does highlight the flaws!",5 months ago,1759593218.310141,0,True,,2026-03-04 21:23:38
UgxY91CIN2UbpL6RI5x4AaABAg,@SramV1,"iPhone 13 Pro Max user here. I still love my phone and whenever I try to upgrade for a newer version, I feel it’s not worth because I didn’t see any attractive features like old times. Current battery health is at 86% and running great so far without any lag. No scratches on the body/screen yet. Also, my 13 pro max version feels premium with its stainless steel side lining and last version of iPhone having a physical sim tray. I wish(?) to upgrade next year if there are any improvements over night camera, AI, looks, etc.",5 months ago (edited),1759593219.079978,87,False,,2026-03-04 21:23:39
Ugx_WAjrJEkb8dHRKPZ4AaABAg,@senthilvigneshkumar,Just now they introduced wide angle front cam?,5 months ago,1759593219.093891,0,False,,2026-03-04 21:23:39
UgyKQPXsOu2Vg1nvSmR4AaABAg,@ethankrieger371,iPhone 12 people ❤,5 months ago,1759593219.109914,1,False,,2026-03-04 21:23:39
UgwruVgZvrGWyhsQy-J4AaABAg,@ethankrieger371,Now I don’t know cuz Aaron sorry if I spelt your name wrong but I thought a while ago you said that the ESR phone case is your favourite.,5 months ago,1759593219.114708,0,False,,2026-03-04 21:23:39
Ugwr8f6oCdO-E8x8IQV4AaABAg,@Darth-Mortem-The-SW-Nerd,Can you make a video all about the apple watch 11?,5 months ago,1759593219.11915,1,False,,2026-03-04 21:23:39
UgwEEbbGrSrw1vfITtB4AaABAg,@JackielouBallo-ke2xs,For Christmas sir,5 months ago,1759593219.124175,0,False,,2026-03-04 21:23:39
UgwOhZ7DY3uqnRvyQrp4AaABAg,@vishnav7007,0:05 its not 50% more iphone 16 pros have 8 gb ram,5 months ago,1759593219.129669,0,False,,2026-03-04 21:23:39
UgyLH8mmIlgEq8MsFGV4AaABAg,@mikedgreat1,It's like he forgot he talked about how the benchmark scores showed it throttling during extended usage. So the gaming experience is not different at all besides the longer battery life.,5 months ago,1759593219.135074,1,False,,2026-03-04 21:23:39
UgwwBsmGyEE_b4xFwxp4AaABAg,@abdulhadikhan896,5:06 bro just charge 1%👽,5 months ago,1759593219.139697,12,False,,2026-03-04 21:23:39
Ugxs_x89qPQJpRocHat4AaABAg,@StefanGenov7,Is that odd I am watching this video but no attention buying an iPhone 17,5 months ago,1759593219.143899,0,False,,2026-03-04 21:23:39
UgyqxLpF-6Xn1dFh15d4AaABAg,@IntenseCity,The bias against apple is a little too obvious here…,5 months ago,1759593219.148603,0,False,,2026-03-04 21:23:39
Ugy3FQ--0Y5ESk7D-JB4AaABAg,@KriscosTake,"Possibly your best video this year. No boring, over done ""omg new phone has new stuff and is da good!"" You actually took an objective look and formed your own idea. Love it.",5 months ago,1759593219.151891,47,False,,2026-03-04 21:23:39
UgziL8eKK2qgHQkiBoB4AaABAg,@GoatVlogger7,Hello Moto Indians,5 months ago,1759593219.154784,0,False,,2026-03-04 21:23:39
UgywmzNge7l5Q8WBOy94AaABAg,@Slaytheday388,"I got a 13 bro can I just upgraded but I haven’t got my phone yet, is it gonna be a huge upgrade?",5 months ago,1759593219.157669,0,False,,2026-03-04 21:23:39
UgwiI0PUHrABU_ILaqV4AaABAg,@TheOnlyEpsilonAlpha,"Imagine calling the iPhone Pro a collection of random things and making a video with random Memes and some weird structure, I'm not stopping at 5:37 because after battery and cameras we got to ""how to scratch it"" I'm Sry but if you're dumb enough to scratch your phone on purpose than you deserve a scratched device. How about making chapters? 

That video was so far a waste of time for me. That useless scratch talk is like the bend talk, breaking news Sherlock: if you apply enough force you can destroy not just every phone on the planet, you can destroy every product on the planet. That's a simple fact. And if you handle your things with care you have longer something from them.",5 months ago (edited),1759593219.160266,0,False,,2026-03-04 21:23:39
UgxlqU39sLaR0FKM9wN4AaABAg,@chaitanyabharate7282,"Hey Arun, I truly commend your great skills and hardwork that you put into each one of your videos. I have been a subscriber of yours since two years at this point. One of the first videos I watched on youtube was yours.

I have come to notice in few of your latest videos that there is at least one comment quite normal in terms of language but the channel leads to other series of channels which are linked to scam websites. Moreover, I noticed that this channel (the one that comments to your videos) is always created the the same day your video is released.

Also, people might fall prey to such scams mainly because you personally like these comments and moreover because of the profile pictures of those channels.

I just thought this should be brought to your notice thinking that you would do your best to eradicate any such risks.

And again, GREAT VIDEO AND GREAT CONTENT! I hope you continue to release such content for years to come!",5 months ago,1759593219.163096,0,False,,2026-03-04 21:23:39
Ugx93QnLTZfYza9sr1B4AaABAg,@LongNguyen-ix5iz,Previous iPhones pros had 8 gigabytes of ram not a 50% increase how can anyone listen to you when the first thing you say on this review is false lol,5 months ago,1759593219.166169,0,False,,2026-03-04 21:23:39
Ugw8PfJBimFyrBFbgzl4AaABAg,@SilentMovements305,A 5yr old phone can record in 8k iphone is jus hype,5 months ago,1759593219.18226,0,False,,2026-03-04 21:23:39
UgyO0kXzCZDEwNsEMfB4AaABAg,@kokomi9367,Yeah the ending was abrupt,5 months ago,1759593219.185477,0,False,,2026-03-04 21:23:39
UgyOi2m08dvVRi9EWNZ4AaABAg,@seanlacroix,4K Apple ProRes log is 10x better than recording in 8k because honestly where are you going to watch 8k video anyway?,5 months ago,1759593219.188152,0,False,,2026-03-04 21:23:39
UgxY91CIN2UbpL6RI5x4AaABAg.ANP9Vvwj6apANPJDQoapyW,@ashu0102,Stainless steel iphone still feels more premium than amy other high end  phone,5 months ago,1759593219.534023,4,True,,2026-03-04 21:23:39
UgxY91CIN2UbpL6RI5x4AaABAg.ANP9Vvwj6apANPur1CAvrj,@decide4yourself2026,You should keep the 13 as long as you can at least as a back up phone. Better to just pay full price for a newer iphone later on than trade in your 13 pro max. The 13 pro max might end up being the last iphone ever with a physical sim tray and just about everything with that phone was so well done it will be an acceptable flagship for many years to come.,5 months ago,1759593219.539465,2,True,,2026-03-04 21:23:39
UgxY91CIN2UbpL6RI5x4AaABAg.ANP9Vvwj6apANPYud_Ls0t,@sojabub,"I'm upgrading from a regular iPhone 13 128 GB and the main reason is that I simply ran out of storage. Performance is still great, everything's snappy, battery is at 92% health after 3+ years and even the regular 13 takes decent pictures. It was the longest lasting phone I ever had and now with 8 times the storage, I'm confident the 17 Pro 1TB will last me 5-6 years.",5 months ago,1759593219.544858,1,True,,2026-03-04 21:23:39
UgxY91CIN2UbpL6RI5x4AaABAg.ANP9Vvwj6apANPsR2L0C_H,@SramV1," @sojabub Yes, storage is the main curse for any mobile. Always buy a larger storage for future needs. I did similar mistake during my Xs and 11 models and lesson learned. Later switched to 512GB minimum.",5 months ago,1759593219.558056,2,True,,2026-03-04 21:23:39
UgxY91CIN2UbpL6RI5x4AaABAg.ANP9Vvwj6apANPiqijLPVN,@DrummingMan1,"I hear you, I think the 13 pro I had was the nicest piece of slab excluding the good old 6s which I thought was excellent in hand experience! I have the 17 Pro and besides the aluminum disappointment, the internals are stellar! The phone will be good for at least five years if I ignore the potential physical damage!",5 months ago,1759593219.563624,1,True,,2026-03-04 21:23:39
UgxY91CIN2UbpL6RI5x4AaABAg.ANP9Vvwj6apANQAWbvwOha,@robinsonhezagira7183,"I’m also very happy with mine, it has never given me an issue. I’m actually hoping to wait for the iPhone 20 so that there’s a generational leap for my upgrade, wish me luck🤞🏿🫡",5 months ago,1759593219.569481,0,True,,2026-03-04 21:23:39
UgxY91CIN2UbpL6RI5x4AaABAg.ANP9Vvwj6apANPlIIWWWiu,@wz-fv2ix,"Uhhh, USB C is enough for me to upgrade",5 months ago,1759593219.574742,0,True,,2026-03-04 21:23:39
UgxY91CIN2UbpL6RI5x4AaABAg.ANP9Vvwj6apANPsh5gEdoQ,@SramV1, @wz-fv2ix You can always buy a USB C to Lightening connector (1/2 inch) if your problem is only with lightning port.,5 months ago (edited),1759593219.57978,1,True,,2026-03-04 21:23:39
UgxY91CIN2UbpL6RI5x4AaABAg.ANP9Vvwj6apANPIFZzz-Rq,@wrongturn77ways,"Mention innovation, but not the durability of the phone. What if Apple started making phones that require you to upgrade every two or three years. Then you'd complain again.",5 months ago,1759593219.584425,2,True,,2026-03-04 21:23:39
UgxY91CIN2UbpL6RI5x4AaABAg.ANP9Vvwj6apANPJ4uiysy6,@SramV1," @wrongturn77ways I agree with you on innovation point, but I’m not complaining anything heavy here. Apple should come with some good upgrades that lasts longer than its competitors.",5 months ago (edited),1759593219.589873,3,True,,2026-03-04 21:23:39
UgwwBsmGyEE_b4xFwxp4AaABAg.ANP6YdOws5-ANTHQNbEjWc,@AlexKrantsevich,bro just lose 1% 👽,5 months ago,1759593219.880709,0,True,,2026-03-04 21:23:39
UgznrgPV-3GfuHnscOt4AaABAg,@indian_monke,I’m still curious about a s25ultra vs iPhone 17 pro max and see which is better in terms of specs?,5 months ago,1759593220.31654,0,False,,2026-03-04 21:23:40
UgycQCS-sSGlL6aD62B4AaABAg,@alexander_martinez6084,Why couldn’t you buy the Escobar 17 😢,5 months ago,1759593220.320612,1,False,,2026-03-04 21:23:40
UgxW5B371mHJDaJc5Lt4AaABAg,@wexken,That was a weird abrupt ending but great video man!,5 months ago,1759593220.32558,1,False,,2026-03-04 21:23:40
Ugx2WcCy-w4o-R7NQoN4AaABAg,@shepzzzzz,Please do a 17 vs 17 Pro video!,5 months ago,1759593220.329108,0,False,,2026-03-04 21:23:40
Ugxy1bXv3yQewPBKU994AaABAg,@SwigerQ86,I phone users coping on how they got reeled in again,5 months ago,1759593220.332501,0,False,,2026-03-04 21:23:40
UgwZgP49hGGl19ECjLd4AaABAg,@stevenqirkle,"Dang I actually went and bought that Torras screen protector even though it was kind of pricey. Debating whether or not to try that case, although probably will try out the Techwoven case from Apple. Torras definitely seems to have upped their game from when I first bought a case from them- an iPhone 12 case that cost like $9.",5 months ago,1759593220.336402,0,False,,2026-03-04 21:23:40
Ugxa4sqBnD-LDHr1EVh4AaABAg,@Storm_167,"Bring back the plus phones, I like big phones so much easier to type, I got the 15 pro max and it’s too small for me",5 months ago,1759593220.38054,1,False,,2026-03-04 21:23:40
UgyEZctuw92VPYdaA-Z4AaABAg,@KyawsoePhyo-m2u,Android users assemble,5 months ago,1759593220.384361,1,False,,2026-03-04 21:23:40
UgxOyAOKrSd6FPRVnQl4AaABAg,@Sirfluffy51,Why can’t apple make a iPhone fold? I would buy that in a heartbeat.,5 months ago,1759593220.389544,0,False,,2026-03-04 21:23:40
UgyVLjzvRhuwFWUkP2d4AaABAg,@durvenator,His team was keen to make the video exactly  11 minutes and 33 seconds long.,5 months ago,1759593220.395074,0,False,,2026-03-04 21:23:40
UgxylAv9emrQAdoFLcp4AaABAg,@mimetic_mechanimations,I LOVE 😍 the orange and wish I could get it on my Pixel 9 Pro!,5 months ago,1759593220.401307,1,False,,2026-03-04 21:23:40
UgwVKIqYVpRBvs1nydJ4AaABAg,@privatename7634,"no ProRes 4K60 internal is a deal breaker, there's a 2TB model...",5 months ago,1759593220.407047,0,False,,2026-03-04 21:23:40
UgweJZspsyXTayfd2rh4AaABAg,@tonyyay1780,Absolutely wonderful  💎,5 months ago,1759593220.412771,2,False,,2026-03-04 21:23:40
UgzRZmx7ujbQ0-QV1cJ4AaABAg,@remybuitenhuis2433,watched almost the whole video and heard of 0 improvements,5 months ago,1759593220.41877,0,False,,2026-03-04 21:23:40
UgwM6-1KGnrQG3hEm7x4AaABAg,@danliejohntagwa1747,"Saying hi, from z fold6😂",5 months ago,1759593220.425253,0,False,,2026-03-04 21:23:40
UgxX9u7jOc1UwYufdSF4AaABAg,@ssamanta72,The ending does say.. something missing.,5 months ago,1759593220.431671,0,False,,2026-03-04 21:23:40
