comment_id,author,text,time,time_parsed,likes,is_reply,parent_id,scraped_at
UgzACgWCHwTJiHsypAR4AaABAg,@auro1986,there they know telephones in country you came from were missing ring tones before they sold cell phones,5 months ago,1759593271.047359,0,False,,2026-03-04 21:24:31
UgyyZcnYMd6u3AZfaAF4AaABAg,@adsv87,"If Apple ever wants to take advantage of the RAM and cooling, hopefully it will be with a desktop mode. The faster USB speed would also help. Maybe this feature will come together with the Ifold.",5 months ago,1759593271.050451,0,False,,2026-03-04 21:24:31
Ugz9s5OaXTuFbLUl0zV4AaABAg,@maitreyidhatrak5975,"Why change the material to aluminum, if they got better thermal cooling?",5 months ago,1759593271.05375,0,False,,2026-03-04 21:24:31
UgzEhHYbvhb9ZBbkvwp4AaABAg,@hanifamishfaq4902,Bro is talking About 17 pro max with comparing with 16 pro max not 25 ultra that’s it!! the win for 17 pros 😂,5 months ago,1759593271.056275,0,False,,2026-03-04 21:24:31
UgwIraxQKCOTLAUwCo54AaABAg,@thisgustin,Wow. Really good thorough reviewer here.,5 months ago,1759593271.059721,0,False,,2026-03-04 21:24:31
UgyDI46Ia5PGeZ_LQ9h4AaABAg,@countbasie20,watching this on my 17 Pro. The battery life got significantly better compared to the 15 Pro and it doesn‘t even really get warm in any situation.,5 months ago,1759593271.062287,0,False,,2026-03-04 21:24:31
UgyZwdQwOjbf5exu3pB4AaABAg,@nioxic77,how is a slightly larger battery giving 10-15% more battery? lol,5 months ago (edited),1759593271.065834,0,False,,2026-03-04 21:24:31
UgxnmJC5dkmKrBWtJ6J4AaABAg,@Dadane,"Of course something’s missing, it’s the coating",5 months ago,1759593271.068465,1,False,,2026-03-04 21:24:31
UgzLE1sUoHRpxdTJO8B4AaABAg,@JKS-qw6fd,I'm happy with my 15 Pro Max😌,5 months ago,1759593271.072106,0,False,,2026-03-04 21:24:31
Ugy5e-5Nh5vqg6Uyls94AaABAg,@Hubris1998,it's for future-proofing,5 months ago,1759593271.074901,0,False,,2026-03-04 21:24:31
Ugz5ulEpvYLONFywOPN4AaABAg,@JKLee-n2n4i,Honestly... whatever new features on any smartphones don'y matter when you're to broke to even buy foods..,5 months ago,1759593271.077414,0,False,,2026-03-04 21:24:31
UgzZfoaKnBdMaKu0K9h4AaABAg,@sludgeman2597,"I'll be upgrading from a 13 to a 17 Pro Max.
I've never had a plus or a pro so I'm really looking forward to the battery improvement and the cameras.",5 months ago (edited),1759593271.080995,0,False,,2026-03-04 21:24:31
UgzfOb_AyyEVlBt_03t4AaABAg,@johnsa55,"Hi I’m keeping my 16 pro max until the 20th Anniversary of the pro max, & yes the Torras screen protector & the great case with the metallic circular ring is so versatile I love it & I don’t have a single scratch on the screen or the body of the phone thanks to Torras case & screen protector brilliant, cheers for your great videos MrBoss 👍",5 months ago,1759593271.083531,0,False,,2026-03-04 21:24:31
UgzsHyfnS3niviGxfUB4AaABAg,@Marl-hj8hh,Liquid Glass looks and works great. I don’t get why all the tech influencers keep talking badly about it.,5 months ago,1759593271.087636,1,False,,2026-03-04 21:24:31
UgzGwLf13q-Y5PlRqD94AaABAg,@maldingarxenaj2883,No perks of upgrading or buying the 17 pro 😂 literally,5 months ago,1759593271.090256,0,False,,2026-03-04 21:24:31
Ugz2SDBljR8p62K8aFJ4AaABAg,@boomboomninja,No one has ever bought appple product in my family but here I m still Watching this.😊😊😊😊,5 months ago,1759593271.093777,0,False,,2026-03-04 21:24:31
Ugx0aqXP6uVN2XpYMGt4AaABAg,@Kurinnaxx,"For the price the aluminum body is  not nice at all somehow others can have a glass back without it ?
But not apple ? And It looks like a Temu phone 
And lets ne real the aluminum is not for thermals at all..
Its an excuse for cheap material.",5 months ago,1759593271.096432,1,False,,2026-03-04 21:24:31
UgzsHyfnS3niviGxfUB4AaABAg.ANNvmI9b3mmANOvPYskfDY,@dannybishop68,Every YouTube I’ve seen has been praising it.,5 months ago (edited),1759593271.410542,0,True,,2026-03-04 21:24:31
Ugx0aqXP6uVN2XpYMGt4AaABAg.ANNvaQoZ7bbANNwaFRbIqj,@sahilsiddiqui5937,indeed,5 months ago,1759593271.718389,0,True,,2026-03-04 21:24:31
UgxxjIayiFcxir0xO9d4AaABAg,@kororogreg649,"I'm watching on my iPhone x 😭😭 
If you have an iPhone 11 you're not using, I'll take it",5 months ago,1759593272.134164,0,False,,2026-03-04 21:24:32
Ugw69TVkLByb6a-jKxl4AaABAg,@Alex-tu5vu,Why do you care about 8k when 4k on an iPhone has a better bitrate or at least quality than 8k on Samsung already?,5 months ago,1759593272.138681,0,False,,2026-03-04 21:24:32
Ugyt4vkkMxU0_nlQpVl4AaABAg,@fillyf5662,There is nothing new which will make ppl buy it .ios 26 sucks I guess only cameras are better even that aluminium body is scratch magnet but still ppl will buy it as if apple is paying them to buy the phone 😂😂😂,5 months ago,1759593272.143536,1,False,,2026-03-04 21:24:32
UgwIfFkLoplHiq2DxHN4AaABAg,@usmantariq7997,"I don't get it, why do we need 8K videos?",5 months ago,1759593273.233954,0,False,,2026-03-04 21:24:33
UgyFu98fJCJySsogmSl4AaABAg,@peterjameson-y9y,Anybody else love it when a new phone comes out? Because then Arun posts almost once every other day for like two weeks.,5 months ago,1759593273.240069,1,False,,2026-03-04 21:24:33
Ugz-G59ZdtLG1nwhcUx4AaABAg,@carlosm14,Too big for me! Hope someday Apple or Google bring back small and more portable phones,5 months ago,1759593273.243026,0,False,,2026-03-04 21:24:33
UgwjlNb1WM_B09cTKp14AaABAg,@sriramannadurai9287,"Dude your contents are good, I always liked them but pulling out a click bait like this? Come on, you are better than this.",5 months ago,1759593273.2463,0,False,,2026-03-04 21:24:33
UgwT4lOn04mGH1Fm_L54AaABAg,@connarr,woah,5 months ago,1759593273.249073,0,False,,2026-03-04 21:24:33
UgyzDD7wTdfncdEeF-N4AaABAg,@KyloRenRaider,"All I want is the iPhone Air’s body, but with the pro max battery, that wont throttle when I play COD mobile. Is that too much to ask?! Cmon Apple figure this out lol",5 months ago,1759593273.252058,0,False,,2026-03-04 21:24:33
Ugx9ilpWHDd_7HQQDhJ4AaABAg,@Aaron-d4n,Iphone is copieïng google pixel,5 months ago,1759593273.254972,0,False,,2026-03-04 21:24:33
UgyvkTyIsTjKa-F8icJ4AaABAg,@praiseezihe,Mrwhosetheboss has been on steroids since iPhone 17 launch 🤯 Also I've never gotten up to a thousand comment l!kes,5 months ago (edited),1759593273.257494,1,False,,2026-03-04 21:24:33
UgyscPWjUpRX5ml_r7F4AaABAg,@fteoOpty64,Neural Engine will do On Device LLM. It would be real cool and super fast.,5 months ago,1759593273.260964,0,False,,2026-03-04 21:24:33
UgyJHgaBl9ORFRSbxIt4AaABAg,@bobgrej1380,"""Completely changed look of the phone"" - i cannot take u serious after this one",5 months ago,1759593273.263583,0,False,,2026-03-04 21:24:33
UgwMMV3y_0jmy6sVlZ14AaABAg,@VIDireWolfIV,The fact you can make a Halo 3 iPhone 17 pro max with the orange phone and green case is peak design 10/10,5 months ago,1759593273.267091,0,False,,2026-03-04 21:24:33
UgxF46gezDXzotab7054AaABAg,@jyotiupadhyay13,Happily watching on 11pro max without any interest to upgrade😎 will wait one more year cu 18 pro max😃,5 months ago,1759593273.269766,0,False,,2026-03-04 21:24:33
UgwBm78asK1A7QsVZsF4AaABAg,@OldSlyEyes,Iphone 15 PM users where we at?,5 months ago,1759593273.272414,0,False,,2026-03-04 21:24:33
UgywD_-lz4Wr5qzUnnl4AaABAg,@AchyutChaudhary,4:32 Thanks for the shout out I guess buddy! 😂❤,5 months ago,1759593273.275552,16,False,,2026-03-04 21:24:33
Ugx5QgEwKhrdYOW8wZF4AaABAg,@unblairable,tellyphoto lens,5 months ago,1759593273.278074,0,False,,2026-03-04 21:24:33
UgwG2E0YVxnvn8eAEn14AaABAg,@edgykoala1732,The production quality is really good.  I also like how the sponsership advertisements just show you what the product is and then we can just move on with the video.,5 months ago,1759593273.28161,0,False,,2026-03-04 21:24:33
UgwMaTkdui97MtfGO3F4AaABAg,@feelieks,4:28 I am on iOS 18 and I also have that line but on just one app,5 months ago,1759593273.284196,2,False,,2026-03-04 21:24:33
UgwMaTkdui97MtfGO3F4AaABAg.ANNuujj5pRlANNv8xxBV4y,@mrhypenight,The line is a feature and moves when you tilt the phone but here in this video the issue is that the line pops up after closing the app.,5 months ago,1759593273.597381,1,True,,2026-03-04 21:24:33
UgwMaTkdui97MtfGO3F4AaABAg.ANNuujj5pRlANNw-Jl-gxr,@feelieks, @mrhypenight  I don’t think I understand 😅. I mean it’s just always there no matter what I do and it’s also only that one app,5 months ago,1759593273.600002,0,True,,2026-03-04 21:24:33
UgzvbRcmV5Hb2zzr-s54AaABAg,@azeller09,"Came from the tv to the phone i just had to comment.
Great video ending, all information recieved? Video over. Simple
Also great review, still not enough to make me move to iphone, but maybe the non pro will...",5 months ago,1759593273.982625,0,False,,2026-03-04 21:24:33
Ugx74butysssaYJate54AaABAg,@dustin0133,"god please no.. we want the cooler phone with longer battery lets not hope that they ""use up the resources"" in the future",5 months ago,1759593273.985256,0,False,,2026-03-04 21:24:33
UgzQ8hv5FAYYNIYtFb94AaABAg,@abdullahmohammad6803,Bro has made so much video on iPhone it’s insane😂😊,5 months ago,1759593273.987739,0,False,,2026-03-04 21:24:33
UgxPTDkuC3AWGBDMu0B4AaABAg,@Dada228822,"The correct answer is: iPhone 17 Pro is preparing for the future, the new Siri is coming when it’s ready (Probably spring 2026).",5 months ago,1759593273.990224,1,False,,2026-03-04 21:24:33
Ugwos8HKicYA3lDq1HN4AaABAg,@PicsNics,"An iPhone user since 2007,  I never knew overheating was ever an issue.",5 months ago,1759593273.99275,38,False,,2026-03-04 21:24:33
Ugz7rsgyMlPLLMpyZGt4AaABAg,@Shashwatawasthie,Watching this on my s10 -,5 months ago,1759593273.995187,0,False,,2026-03-04 21:24:33
UgzVssRBRlf3IEusu3h4AaABAg,@REALHARSH,"In my few days experience with the iPhone 17 pro it’s no better than the iPhone 16 pro. I am a VERY heavy user too. Still dims the screen, still gets hot, charges ( according to my charger with display read out ) at 20w. 
The camera is not as good as the iPhone 16 pro ( in my limited testing ) 
Battery does seem better but unless you’re going to get 2 full days then you have to charge it every evening anyway so that’s kinda pointless. ScratchGate too…. I’ve not scratched mine yet but looks concerning",5 months ago,1759593273.997642,0,False,,2026-03-04 21:24:33
UgxNGPCKat8nqdZ5W1l4AaABAg,@PunsOfThunder2020,Wow arun. Are you going on vacation soon? Dropping videos right and left. we didn’t get to see your signature edits.,5 months ago,1759593274.000598,0,False,,2026-03-04 21:24:34
Ugw14qbBStGOHI3fwwx4AaABAg,@neodidi,"Look up realme mix 11 or so.. 
Look up itel phones, old designed phones.. You'd see why this apple design feels like a cheap solution..",5 months ago,1759593274.003082,0,False,,2026-03-04 21:24:34
Ugy8NESxHt2imwXLfWR4AaABAg,@feelieks,Can u buy a new house? I loved that series❤,5 months ago,1759593274.005544,1,False,,2026-03-04 21:24:34
Ugzbvj_ZVLgCpE5URXR4AaABAg,@kankisingi,Why have you not done such reviews on the pixel 10 serie while it is clearly more interesting?,5 months ago,1759593274.008022,0,False,,2026-03-04 21:24:34
UgxrQP046WvRTUZ5-2p4AaABAg,@Doomsxxrl,"Updating to iOS 26 on my iPhone 11 might be my worst decision yet, my battery lasts 10 seconds after disconnecting",5 months ago,1759593274.010464,0,False,,2026-03-04 21:24:34
UgwyJQfoJXovLOzWL1V4AaABAg,@Reflectznnz,😂😂😂,5 months ago,1759593274.012905,0,False,,2026-03-04 21:24:34
UgynYNSlyGo2jQlJwI54AaABAg,@Pickles-o1s,"✋✋I know what's missing!!!
A headphone jack.
(Yes I'm still salty about that...)",5 months ago,1759593274.016187,0,False,,2026-03-04 21:24:34
Ugw0fHM72Y9ni0qNA1l4AaABAg,@Signal_Noise_Official,Who cares about 8k video? The sensor would be too small for it to be useful at all. Literally the only cameras that benefit from 8k are the super expensive Red cameras with huge sensors,5 months ago,1759593274.018692,2,False,,2026-03-04 21:24:34
UgxCoMa__MJAaTqZPpZ4AaABAg,@SckallyWag,I literally JUST bought at 16,5 months ago,1759593274.021171,0,False,,2026-03-04 21:24:34
UgyAUR2a9ANs1IEErfF4AaABAg,@A7MODES,7:05 i think the marks are more visible on the 17 pro max because of the anti reflective coating getting scrapped away i think glass it self is fine and the marking would be visible in very specific angles,5 months ago,1759593274.02365,41,False,,2026-03-04 21:24:34
Ugynnmo3f8-ykJa8GMR4AaABAg,@rashed434,I don’t understand the telephoto criticism. If you’re close to the subject you should use 2x or macro.,5 months ago,1759593274.0261,0,False,,2026-03-04 21:24:34
UgzGL1IGBvbfZP4WZ6Z4AaABAg,@falconmcan84,Aluminium is aluminium nand it never changes. Always bad for scratches and this year is also heavier too. I bought and Air instead of Pro versions after 3 year pro series,5 months ago,1759593274.028529,1,False,,2026-03-04 21:24:34
UgwuHNqW8GeZDZxcxmZ4AaABAg,@sankaranarayanan616,What's going on with Arun's hairline and volume? 🤔 🤔,5 months ago,1759593274.031195,0,False,,2026-03-04 21:24:34
Ugwos8HKicYA3lDq1HN4AaABAg.ANNulK63fbcANOlY-IU8T-,@medogerty6013,"Try playing Minecraft. I have a 15 pro and it still overheats, even with the new shaders turned off.",5 months ago,1759593274.336807,5,True,,2026-03-04 21:24:34
Ugwos8HKicYA3lDq1HN4AaABAg.ANNulK63fbcANP-2DISiQr,@Anthony-g1v8p,"ive had it happen in Arizona in the car, rarely though",5 months ago,1759593274.339371,1,True,,2026-03-04 21:24:34
Ugwos8HKicYA3lDq1HN4AaABAg.ANNulK63fbcANPTgJtmF9I,@Benst2178,"Same, never noticed any overheating on any iPhone. But I also don’t play 3D games or shoot 4k videos so that’s maybe why.",5 months ago,1759593274.341902,1,True,,2026-03-04 21:24:34
Ugwos8HKicYA3lDq1HN4AaABAg.ANNulK63fbcANPnhFowiPR,@zyped18,"My wife left her ip13pm on the dashboard of the car for almost an hour, got overheating warning, after cooling down, works like new again. I got a 16pm but i think the 13pm was realy built like tank, the only issue was the green screen, but was replaced by apple even after the warranty has expired.",5 months ago,1759593274.344385,0,True,,2026-03-04 21:24:34
UgyAUR2a9ANs1IEErfF4AaABAg.ANNuSv5vigOANO7_FBQqOi,@YUGOT,Jerry rig everything video for scratch resistance,5 months ago,1759593274.701935,5,True,,2026-03-04 21:24:34
UgyAUR2a9ANs1IEErfF4AaABAg.ANNuSv5vigOANPBAAIikUE,@aussiedude3121, @YUGOT yeah Jerry rigs test shows it’s a lot more scratch resistant,5 months ago,1759593274.705037,5,True,,2026-03-04 21:24:34
UgyAUR2a9ANs1IEErfF4AaABAg.ANNuSv5vigOANO3fkKOWA0,@MoGreeny,The glass is fine because Samsung made it but the and the anti reflective coding is from Apple,5 months ago,1759593274.707559,2,True,,2026-03-04 21:24:34
UgyAUR2a9ANs1IEErfF4AaABAg.ANNuSv5vigOASmQfr-0VJ8,@rrowans, @MoGreeny then why does samsungs s25u still scratch at a level 6 😂,1 month ago,1770220474.71019,1,True,,2026-03-04 21:24:34
UgwTWtpMRaqAmcgnQe54AaABAg,@Devean-ui2di,"A lot of people don’t seem to notice the fact that they’re battery life, no matter the age or condition, seems to worsen every year as every IOS update/phone releases. I feel this is very intentional to bolster the idea of newer phones having a better battery life",5 months ago,1759593275.815189,0,False,,2026-03-04 21:24:35
UgwCiE3EiG9fRKUl5Gx4AaABAg,@LongLiveCGR,WHO NEEDS 8k RECORDING?!,5 months ago,1759593275.817821,0,False,,2026-03-04 21:24:35
UgwFFp-woWf_fIhAyXN4AaABAg,@belloabubakar8776,pls give me one iphone i only have iphone xr,5 months ago,1759593275.820319,1,False,,2026-03-04 21:24:35
UgxT7cPgXtxqhPBZDU54AaABAg,@88spaces,"The 16 Pro is great. I don't see a need to upgrade unless of course you want any AI which, as you've heard, is coming. Yeah, it is. We just don't know when.",5 months ago,1759593275.921702,0,False,,2026-03-04 21:24:35
Ugx5Ha0-7k-C9K4wBC94AaABAg,@brada55,What to buy iphone 17 pro max or iphone 17?,5 months ago,1759593275.92522,0,False,,2026-03-04 21:24:35
UgwiJMkYZz4J9DpGMMt4AaABAg,@wesamal6302,"iphone 13 pro max , still going strong. Can't justify to buy another for now",5 months ago,1759593275.928512,0,False,,2026-03-04 21:24:35
Ugwzz32uZiSLj8ULyhN4AaABAg,@omarbaba9892,"Don’t get the hate for the look of this phone, I think they look Samsung and a lot better then the other pro phones",5 months ago,1759593275.932414,0,False,,2026-03-04 21:24:35
UgzVIzF7tWwCh09mB3x4AaABAg,@Murty126,Im curious! Compared to your world's biggest iPhone how good would you compare the 8phone 17 too it?,5 months ago,1759593275.93614,0,False,,2026-03-04 21:24:35
Ugyg9rEJr6uT-7pN3bx4AaABAg,@Kentpaul1988,Maybe just save your money and wait till the iPhone 18 comes out to see if these features are implemented because spending big money on a new phone only makes sense if you can make the most of it and we are still waiting for Apple to do that.,5 months ago,1759593275.941605,0,False,,2026-03-04 21:24:35
UgxxoB75wwGBImSuWwF4AaABAg,@chhotabheem-if8cf,"3:06 looked for ""That's what she said""",5 months ago,1759593275.947153,0,False,,2026-03-04 21:24:35
Ugy1SLFPQQGG2v2-nzN4AaABAg,@lorcomanstudios8294,"I have the 15 and watched this video for fun, I’m still sad about how i didn’t get any of the Apple Intelligence features on my phone, and now I’m going to upgrade to the 17 i swear to god if apple does the “only for iPhone 17 pro and air” move again!!!",5 months ago,1759593275.952919,0,False,,2026-03-04 21:24:35
Ugw_4sE2S0WpemJ-o_N4AaABAg,@dyor7504,"I just wanna say that the Screen Scratching and Body Scratching tests are wrong 
It's pretty good we have Jerry to clarify these things",5 months ago,1759593275.959601,0,False,,2026-03-04 21:24:35
Ugw-fTizOsA7e4qKHGV4AaABAg,@kklam0611,Samsung galaxy S25 ultra?,5 months ago,1759593275.965872,0,False,,2026-03-04 21:24:35
Ugwgp4YmOJdnPHFK_Gt4AaABAg,@RubenNeves22,"I agree, if there were a 17 Plus it would reduce the Pro Max sales significantly",5 months ago,1759593275.973231,0,False,,2026-03-04 21:24:35
Ugx0-lbHImTyq1TsE1l4AaABAg,@pez555,"I have been a pro user since the iphone 11 pro max, and for the first time since, I think I no longer need to keep using the pro model. I have come to realise that I no longer need the extra stuff just for the sake of having the best model. I truly think for the first time that the pro is now aimed at actual pro users. I know that is a weird thing to say but the features of the new phones just don't tick many boxes for me as a general iphone user. I think that is also why they beefed up the specs of the normal 17 and introduced the air. For me, the air is the most attractive prospect of a new phone, but I think next years air will be the one to get. 3",5 months ago,1759593275.97825,0,False,,2026-03-04 21:24:35
Ugw0fsozLCXd4KmpEUJ4AaABAg,@anshjoshi26,"0:12 Exactlyyy mann!! As an embedded firmware engineer, this was a HUGEEEEE deal for me",5 months ago (edited),1759593275.984146,82,False,,2026-03-04 21:24:35
UgwNTWCFCAybpxC33vF4AaABAg,@xultimate_storm,"Hello guys I switched from the 15 PM to the 17 PM and had a Belkin ultraglass screen protector installed on both on them. 


I know that the 17PM has a new coating that is more anti reflective but I also noticed that the screen seems a little bit more matte/ rougher like the paperlike screen protectors on the iPad but not on that level just like 4-5%.

Idk could someone maybe confirm this change cause the display on my 15PM seemed clearer and it drives me insane cause I’m thinking something with my phone or screen protector might be wrong.",5 months ago,1759593275.988211,0,False,,2026-03-04 21:24:35
UgxS9nHo2O7y_7261_x4AaABAg,@Eldred_plays_efootball,Why am I watching this again?🤓,5 months ago,1759593275.99174,0,False,,2026-03-04 21:24:35
UgyyfgY3pKSKNu2pGOJ4AaABAg,@guillermitodeir4900,Next year you will have the ip18  made for AI   😂😂,5 months ago,1759593275.994383,0,False,,2026-03-04 21:24:35
Ugz_94yWkxFZ9YboWr54AaABAg,@AdventureNW,iPhone 16 pro max gang,5 months ago,1759593275.997464,0,False,,2026-03-04 21:24:35
Ugz2yaEhmMge-ns9hX94AaABAg,@Panda335-z1r,I really want those wallpapers... they are great,5 months ago,1759593276.393313,0,False,,2026-03-04 21:24:36
Ugy9LYeGp3ue586Apy94AaABAg,@from2100,Am I the only one who always looks to the right first when Arun does the old vs new comparisons excepting the new one to be on the right?,5 months ago,1759593276.396769,0,False,,2026-03-04 21:24:36
UgzpsUac9c6H8qiSd3t4AaABAg,@manishbalam,Samsung agent. Hmm,5 months ago,1759593276.399636,0,False,,2026-03-04 21:24:36
UgzZBb6KCAH4RdSzAeR4AaABAg,@piyushagrawal8992,8k video is a gimmick. No professional is ever going to use it. Why do you even need that?,5 months ago,1759593276.402195,0,False,,2026-03-04 21:24:36
Ugz_cpQarSr-0eKp3el4AaABAg,@internetchunk6541,iphone 17 or pro.. can't decide..,5 months ago,1759593276.404689,0,False,,2026-03-04 21:24:36
UgwcSp9QNKHNBkvApmd4AaABAg,@Tammacazi10,iPhone 14 pro here. Debating on just getting a battery replacement,5 months ago,1759593276.407153,0,False,,2026-03-04 21:24:36
UgweeHWO9gGmZk-Vlpx4AaABAg,@omarbaba9892,Going from my iPhone 14 to the 17 pro has been insane,5 months ago (edited),1759593276.409645,0,False,,2026-03-04 21:24:36
Ugy4uDg-Dr1iIw3gs8V4AaABAg,@MrMozkoZrout,"This generation with the iPhone air exists mostly as a tech demo but i don't think it's for the AI, even tho that might be true, i think it's mostly for the upcoming iFold.",5 months ago,1759593276.413152,0,False,,2026-03-04 21:24:36
UgwIAsqhdaSN5nymZNh4AaABAg,@peterjameson-y9y,Can we see a cheapest vs most expensive headphones video?,5 months ago,1759593276.41916,0,False,,2026-03-04 21:24:36
Ugy32fIyt2GxUWeRv454AaABAg,@KabirChoudhury-e9u,Bro what happened to your hairline,5 months ago,1759593276.422774,1,False,,2026-03-04 21:24:36
Ugzk78ei6hRvkPPYWkh4AaABAg,@MichaelJoseph83,i just watched a review on 17 camera only by a pro and he talks about how he is happy 8k video isnt on iphone and how it is more of a niche on phones,5 months ago,1759593276.425576,0,False,,2026-03-04 21:24:36
Ugy2O-r17p9PJhnmKs54AaABAg,@Ultrajamz,Outdoor brightness better?? Compared to 14 pro?,5 months ago,1759593276.428538,1,False,,2026-03-04 21:24:36
UgxTsgmRh0gEgMkxxJt4AaABAg,@Ecohen52784,Downgrading from the iPhone 16 pro to the standard iPhone 17.,5 months ago,1759593276.431071,0,False,,2026-03-04 21:24:36
UgyLMC2DrTW9Bo8vojV4AaABAg,@mrmarecki1,"After Apple completely failed to deliver AI features promised for 16, I think it's a complete joke to suggest them as selling point for 17 before they materialize. If they do, they'll be tuned for 18 anyway, so might as well wait a year (or buy a Samsung with features that already exist, not just on paper).",5 months ago,1759593276.433872,0,False,,2026-03-04 21:24:36
UgzEoKPBXdRbghu_x4d4AaABAg,@HeatProofBog64,"Suspect you are right on the ‘next year’. I fully believe this is the hardware they want developers to have in their hands when WWDC 26 happens, so they can start using all the new automations & APIs. For consumers it is a skippable generation made for future proofing.
I am an ex-tech fanatic. Used to upgrade twice a year, now, waiting for an iPhone that’s worth it",5 months ago,1759593276.436426,0,False,,2026-03-04 21:24:36
UgxNZo4qOFRoJoV9gEt4AaABAg,@marcusmartinez3692,I love my iPhone 17 pro max is amazing 😻 yayyyyy,5 months ago,1759593276.439604,0,False,,2026-03-04 21:24:36
UgyfdbIlp64MzmCcLYp4AaABAg,@deandiamond791,What an ending!,5 months ago,1759593276.442312,0,False,,2026-03-04 21:24:36
Ugy_oLOQCAaApkgffOF4AaABAg,@MCBeremus,I guess you can look at @JerryRigsEverything to understand the 3x scratches perf.,5 months ago,1759593276.444837,0,False,,2026-03-04 21:24:36
Ugx9LFVlfls9Ce8frzl4AaABAg,@rohanempire1212,Should I upgrade from a xs that I bought used and have owned for 6 years to a 17 pro. Thoughts ?,5 months ago,1759593276.448639,0,False,,2026-03-04 21:24:36
UgwWSHYDaadoV4u6NLN4AaABAg,@abdellaziz-,"The vapor chamber is sticked to the battery,so heat goes to it , which make it degrade rapidly:) .",5 months ago,1759593276.453512,1,False,,2026-03-04 21:24:36
UgxTsgmRh0gEgMkxxJt4AaABAg.ANNtY9Hb0BOANNtpoP_Hv8,@omarbaba9892,It really isn’t a downgrade at this point,5 months ago (edited),1759593276.769774,0,True,,2026-03-04 21:24:36
UgzXlydM0IEO6ZXDA_x4AaABAg,@ttcthetechnicalck,"I'm confused. I want to buy a phone, my preference is camera...

1. Samsung S25 Ultra

2. Vivo X200 Ultra

3. Oppo Find X8 Ultra

Which one should I buy? I really like the Vivo X200 Ultra, but I've been a Samsung user since childhood, from 2019. I used the Samsung Galaxy A70, and then from 2022, I used the Samsung Galaxy A52, and I like both the S24 Ultra and S25 Ultra. I've never used the S Pen, and after seeing the Vivo X200 Ultra's camera, I started liking that phone a lot. What should I do? Vivo's origin OS will be there, but I was using use One UI from 2019. Will I regret if I get into origin os from one UI?",5 months ago,1759593277.186068,1,False,,2026-03-04 21:24:37
Ugxl1ub0iUljMqMlOyB4AaABAg,@HajongLee,"7:14 probably because with the new square sensor on the front, more people will now start to just hold the phone in portrait mode, whether that's taking a video or using facetime that requires the mic to be used.",5 months ago,1759593277.188759,0,False,,2026-03-04 21:24:37
Ugzv7LJQq4oSdGv85j94AaABAg,@Why-v7p,"Still miles behind a top android device 
Nice to have one tho I got one it’s ok not worth the price no way",5 months ago,1759593277.191855,0,False,,2026-03-04 21:24:37
UgxHAqvUmK5Frh0Kkm94AaABAg,@monukha87,"The orange one looks like the first CMF phone to me, tbh",5 months ago,1759593277.194409,0,False,,2026-03-04 21:24:37
Ugz4o-T4Y15gHGOHSBl4AaABAg,@exploreevery,Thumbnail is wild,5 months ago,1759593277.19797,0,False,,2026-03-04 21:24:37
UgxRv7d8vibaGMy2i1Z4AaABAg,@Embery,2nd embargo vibes,5 months ago,1759593277.200599,0,False,,2026-03-04 21:24:37
UgzT7mwTqfLqhXQ_1oZ4AaABAg,@gcarter1973,Absolutely boring! Same as every other iPhone for years.,5 months ago,1759593277.20323,0,False,,2026-03-04 21:24:37
