comment_id,author,text,time,time_parsed,likes,is_reply,parent_id,scraped_at
Ugx-LF48vgQnA8hisD94AaABAg.ANNhInelYvYANNv52fp0tI,@grabedigger," @oo0Spyder0oo  yup, my CLOG-3 videos from my R6 and R6 II retain a lot more information without ProRes 422 and are way easier to grade. rec2020 Apple Log isn't for the faint of heart.",5 months ago,1759593327.164442,0,True,,2026-03-04 21:25:27
Ugx-LF48vgQnA8hisD94AaABAg.ANNhInelYvYANQ6HUoFd37,@AlexMontalvogaming101,Galaxy all ready record in RAW right?,5 months ago,1759593327.166937,3,True,,2026-03-04 21:25:27
Ugx-LF48vgQnA8hisD94AaABAg.ANNhInelYvYANV9zQ1PQmw,@AlexMontalvogaming101,"just saying this because since the galaxy s24 i can record is RAW, now can the iPhone 17 record in LOG? that will make it or brake it for me.",5 months ago,1759593327.169419,0,True,,2026-03-04 21:25:27
UgysKfznGlyV1CMTzkR4AaABAg.ANNhEX-XBWvANNhHL9djVO,@chasefisher6317,^Feeling no difference between any of them!!!!,5 months ago,1759593327.498846,0,True,,2026-03-04 21:25:27
Ugy5pE-FbZPh60LxNNx4AaABAg,@nurafiqnoorhisham8263,u know tech is scamming us when last year flagship is noticably slower than this year flagship.,5 months ago,1759593327.938093,0,False,,2026-03-04 21:25:27
UgyKbLuaCfQPKCV77b94AaABAg,@itssmelia.,How do people afford these as they release👀,5 months ago,1759593327.940745,2,False,,2026-03-04 21:25:27
UgyxF4YCSwNYobCV5U14AaABAg,@momochan4peace,"I'm a samsung fan and user but but I like learning about the iPhones whenever I cuz...like Senku said ""learn everything, try everything"". I've already used two iPhones and ngl, didn’t enjoy my experience but I still love learn abt the phones.

Bottom line is, this was a great video and quite educative 😊",5 months ago (edited),1759593327.943224,2,False,,2026-03-04 21:25:27
UgxDi_YltB95FXYD7nR4AaABAg,@Rensim1,What is your obsession with 8K? it's a completely useless feature on a phone,5 months ago,1759593327.945716,0,False,,2026-03-04 21:25:27
UgwlTU7o_EtXllPc4Ld4AaABAg,@egertkapp2865,nice,5 months ago,1759593327.94818,0,False,,2026-03-04 21:25:27
UgxsXaa-0nPsKHSU68l4AaABAg,@TheGaang,"9:12 funny how you say this, yet it’s not even available in your home country lol",5 months ago,1759593327.950866,2,False,,2026-03-04 21:25:27
UgxzU3RU2GBI_0X0hJh4AaABAg,@TripBoomer69,"Yet another year where Apple fail to hook me into taking a drippy nose approach to tech. 
I still don't see the benefit too Apple, for it to be worth it you need to buy everything Apple not just your phone, So not just a GPU priced phone, but also have to buy an overpriced & under-spec'd laptop, tablet, watch, ear buds, music, apps, accessory's... 

So to choose to switch to Appleis 3K+ & Id rather by an RTX5090 & a new PSU, than switch to Apple! 

& I am sorry but I just love Technology too much to bend over and hand Apple the VaselIne! & replace the word upgrade with replace! 

Which is the Apple way!... there moto is... ''if it's dusty then replace it!'' 
Because Apple are not letting you clean that dust out! and will go out of their way to make it more difficult to do it!

If Apple disappeared tomorrow I would consider it a win for Technology!!",5 months ago,1759593327.953377,1,False,,2026-03-04 21:25:27
UgwktVVipMtTXywdPX54AaABAg,@kelvinnosakhare5334,You are dam right iPhone gave us a future phone for the present,5 months ago,1759593327.955847,0,False,,2026-03-04 21:25:27
UgxLGzcupog6CPLPdtl4AaABAg,@olerius1235,crazy video pull,5 months ago,1759593327.958322,0,False,,2026-03-04 21:25:27
UgxmjkzRZRr736P-gdB4AaABAg,@dfordesmondg,that ending was real abrupt,5 months ago,1759593327.960788,0,False,,2026-03-04 21:25:27
Ugw1upVm9-5LBL1mxKt4AaABAg,@yeamanbhuiyan,"Because of poor AI, apple gave-way a lot of features to all of their devices, that’s why people should support tech over brand.",5 months ago,1759593327.963247,0,False,,2026-03-04 21:25:27
Ugw4o9abAivaCPUqxKR4AaABAg,@Maytreex,...and yet another video. You need an award for consistency,5 months ago,1759593327.966169,0,False,,2026-03-04 21:25:27
UgzGBSWi4e6ktqpa2zR4AaABAg,@Jbeans11,"I know what Apple is doing, making the iPhones picture and video quality so good and take so much space so you have to pay for the iCloud. Look at the base models. They all have 48mp cameras. They only did that to make you pay for the iCloud storage",5 months ago,1759593327.96883,0,False,,2026-03-04 21:25:27
UgxRt65-MMZQzNIN1tl4AaABAg,@mohamedalkirshini7972,hahahaha ridiculous phone from a ridiculous company,5 months ago,1759593327.971329,0,False,,2026-03-04 21:25:27
UgyOSqBYkHnMFHGcHhN4AaABAg,@v_stands_for_value124,"Nice phone, I'll wait next year",5 months ago,1759593327.973812,0,False,,2026-03-04 21:25:27
Ugxf_khSmLNJW3iJ2Cp4AaABAg,@M.Habeeb,I think the scratches you made are on the anti-reflective coating. In Jerryrigs Video the Screens seems to be harder to scratch. These coatings are prone to scratch as seen on the s24 Ultra,5 months ago,1759593327.976289,0,False,,2026-03-04 21:25:27
UgwsuKiWVatdIDk5Kqd4AaABAg,@卂丨,"I think Youtube should make a separate section for actual comments about the video, the entire comment section is filled with random BS and I had to scroll a good extent to find actually useful comments about the video",5 months ago,1759593327.980947,0,False,,2026-03-04 21:25:27
Ugy9LksvsOIbOGVG_5J4AaABAg,@gbw4908,Nice,5 months ago,1759593327.985273,0,False,,2026-03-04 21:25:27
UgxLkZYabQy43MbHSt14AaABAg,@NijoTJ,"This is just glazing tbh, yeah this video felt actually bad because it was just a lot of these things and bad and the same things are good, yeah we get it, you love the phone.",5 months ago,1759593327.987847,0,False,,2026-03-04 21:25:27
UgxF-RKrrSf3oJxbnWV4AaABAg,@hanauzaki6264,D1 glaze 😊,5 months ago,1759593327.990347,0,False,,2026-03-04 21:25:27
UgyxF4YCSwNYobCV5U14AaABAg.ANNh6JWRo4MANNhz7yjsqO,@J-Specter-c3h,A fellow dr stone fan 🤝,5 months ago,1759593328.31736,0,True,,2026-03-04 21:25:28
UgxiS2vIWJc0LLAExf94AaABAg,@ItzJupiter,"Arun's on an absolute roll! 5 videos in 5 days, and here I was thinking the schedule was slowing down a bit1",5 months ago,1759593328.852093,0,False,,2026-03-04 21:25:28
UgzFAd2MLAcQrVVUNP94AaABAg,@ChillKenny,I love my 17 Pro max,5 months ago,1759593328.855351,0,False,,2026-03-04 21:25:28
Ugw2Kqo0P-qMi34f0jx4AaABAg,@weirdestguyever4533,Can I get one?,5 months ago,1759593328.857961,0,False,,2026-03-04 21:25:28
Ugxkj81oTQptC2vs-BB4AaABAg,@81179venky,Air is better than Pro for 95% people.,5 months ago,1759593328.860432,0,False,,2026-03-04 21:25:28
Ugz07-I3vPWTrl1jPIt4AaABAg,@thisisritzy,"What an AMAZINGLY done REVIEW! Your dexterous analysis and your laser focus on the consumer's experience is commendable, Arun. Amazing stuff - really good review with total neutrality",5 months ago,1759593328.863198,6,False,,2026-03-04 21:25:28
Ugyn1axprjRlYE59qFB4AaABAg,@Yashk58,I think the reason for not talking about ram is coz they don't want people to focus on it that much coz they don't upgrade it regularly and putting spotlight on it will just create expections just like what's happening with titanium now.,5 months ago (edited),1759593328.955378,3,False,,2026-03-04 21:25:28
Ugz2SVhFibIUeDfEmyh4AaABAg,@shadyopss,The end of the video is a bit abrupt. Caught me off guard 😂,5 months ago,1759593328.959676,0,False,,2026-03-04 21:25:28
UgwufnWhblSgGP5JKGx4AaABAg,@-AhmadUmair,0:17 yeah because it will still lag behind android 😂😂😂,5 months ago,1759593328.964388,20,False,,2026-03-04 21:25:28
UgzZ_Q6az_z6YUBZNX54AaABAg,@garvmalani,Just got iPhone 16 Pro for 780 USD in Flipkart sale,5 months ago,1759593328.969353,0,False,,2026-03-04 21:25:28
Ugw0zIRvusqnZGEor2N4AaABAg,@sandithyawijerathne6962,Bro is casually dropping 5 banger videos in 1 week💀,5 months ago,1759593328.972109,3,False,,2026-03-04 21:25:28
UgyevMnk36CRo-WbLcp4AaABAg,@granitb,that BOSS sweatshirt is so distracting.,5 months ago,1759593328.976294,0,False,,2026-03-04 21:25:28
Ugyr0S3XE0JWj0u0tZN4AaABAg,@DwayneDibbIy,It's just a phone,5 months ago,1759593328.982698,0,False,,2026-03-04 21:25:28
UgxDKvLjsmYgkFTYoep4AaABAg,@Atl3636,iPhone 17 pro max vs Xiaomi 15 ultra plss,5 months ago,1759593328.987124,1,False,,2026-03-04 21:25:28
UgxaZQHNim3XMa2Dawp4AaABAg,@Khansa-ab,Why is nobody talking about the OIS on a selfie camera ?,5 months ago (edited),1759593328.993001,0,False,,2026-03-04 21:25:28
Ugyt_8nu7sOy_LV3rLZ4AaABAg,@RyeRyeL,"Me sat here with a 17 Pro Max feeling like the front camera is an absolute letdown even vs my S24 Ultra I came from. 

Back cameras are massively over processed. I am currently very disappointed with the iPhone. I’m shocked how Samsungs front cameras look SO much better. How bad was the front camera before if it’s this bad on the 17 lineup!!?!

My first iPhone ever and am far it feels like a giant letdown. The only plus so far is battery.",5 months ago,1759593328.996783,0,False,,2026-03-04 21:25:28
Ugws072w10lfWYP29DV4AaABAg,@lindadumarwah7341,sir how much have you posted in the last week,5 months ago,1759593329.000382,0,False,,2026-03-04 21:25:29
Ugwpxt7H_c8tdr80Yt54AaABAg,@isaiahrozeboom,I’m upgrading from my 14 pro max to a 17 pro max is that gonna be a major update? I’m fairly techy but I honestly have no idea,5 months ago,1759593329.006756,0,False,,2026-03-04 21:25:29
Ugx3u5NKFZTpPfYe85F4AaABAg,@ariescorner7655,"Wow, that ended abruptly.",5 months ago,1759593329.012302,0,False,,2026-03-04 21:25:29
UgxWm3tHEDMravbPSmd4AaABAg,@mghummer,1:58 Am i the only one thinking video from default camera app is much better then prores raw,5 months ago,1759593329.015142,0,False,,2026-03-04 21:25:29
UgyQXJGcFYPIilc9MSN4AaABAg,@badllama8090,"Raw footage... great for the 0.01% of people/buyers that will use it! 
I for one am sick of the'hype' around camera functions on phones, I have a camera, a good one thanks, give me TRUE innovation and a couple of days power from the battery!",5 months ago,1759593329.018561,0,False,,2026-03-04 21:25:29
Ugw2Kqo0P-qMi34f0jx4AaABAg.ANNgvj5OdIYANNgxEXisV5,@weirdestguyever4533,Please 🙏🏾?,5 months ago,1759593329.397764,0,True,,2026-03-04 21:25:29
UgwufnWhblSgGP5JKGx4AaABAg.ANNgsSZGFkJANNiAj3FdUv,@michaeladebz,??? The a19 is the fastest mobile cpu in all aspects.,5 months ago,1759593329.740787,10,True,,2026-03-04 21:25:29
UgwufnWhblSgGP5JKGx4AaABAg.ANNgsSZGFkJANNimMWHUnX,@LaitnetopRuoyHcaer,"As in Samsung 😂the worst lagging phone ever. Oh. Wait all androids, after 3/6  Months they are just pure lag, 😂",5 months ago (edited),1759593329.746907,9,True,,2026-03-04 21:25:29
UgwufnWhblSgGP5JKGx4AaABAg.ANNgsSZGFkJANNhEvLgzya,@DeRock401,That’s funny cuz Samsung has the worst lag out of any phone,5 months ago,1759593329.751328,19,True,,2026-03-04 21:25:29
UgwufnWhblSgGP5JKGx4AaABAg.ANNgsSZGFkJANNlJaedLJi,@SusPogMonkey, @DeRock401 mines running perfectly fine???,5 months ago,1759593329.757271,0,True,,2026-03-04 21:25:29
UgwufnWhblSgGP5JKGx4AaABAg.ANNgsSZGFkJANNoFP9KBpL,@KingCruzCorp,I have a samsung it's alright but my 16 pro max does alot better in aspects and I imagine my 17 pro max will be better,5 months ago,1759593329.761947,0,True,,2026-03-04 21:25:29
UgytSQehcN77vZbJSs94AaABAg,@Yessir69-d5m,I hate how good the base iphone 17 is cuz the pro wont feel as cool lol,5 months ago,1759593330.208706,0,False,,2026-03-04 21:25:30
UgxYKr52_nFpMeOjYAB4AaABAg,@adriaanschiltkamp5130,Now a word from our sponsor: Apple!,5 months ago,1759593330.211909,1,False,,2026-03-04 21:25:30
UgwYQxM7GxfkLa-OrOd4AaABAg,@TheAmpress,...... the phone will be obsolete by the time the main features exist😂.,5 months ago,1759593330.215273,0,False,,2026-03-04 21:25:30
UgwymtOmoe53bL2-1-x4AaABAg,@satvikchopda5166,"Nice review, very informative.",5 months ago,1759593330.219147,0,False,,2026-03-04 21:25:30
Ugyr91zJGobaxKoT4-54AaABAg,@forrest3491,"Lmao that ending. Retention, I guess",5 months ago,1759593330.222074,0,False,,2026-03-04 21:25:30
UgwaPz2rOCsal9jQ2S54AaABAg,@BasilioSande,"This guy has 1 Google Pixel video titled ""Too much Google""

And just uploaded 5 iPhone 17 videos of a phone that barely changes. I'm sure he's paid by iPhone",5 months ago,1759593330.22471,0,False,,2026-03-04 21:25:30
UgxSH_hWQK2DJ4NwcXJ4AaABAg,@patrikmiskovic791,"Nothing special , when I look at new xiaomi 17 pro  😍",5 months ago,1759593330.227647,0,False,,2026-03-04 21:25:30
Ugxh2PKbBzjeO7tl42N4AaABAg,@ScottMedinaX,Apple is also starting to fall into the trap of marketing features and not lifestyles. If they’re not careful they’re going to be just like Samsung lifestyle branding is what made them so powerful in the beginning and they’re losing their way from a marketing and advertising perspective. They’re marketing by bullet points.,5 months ago,1759593330.230196,2,False,,2026-03-04 21:25:30
Ugxi0yHR361HTv7I1ad4AaABAg,@IamKDog,8:11 Why is the old model on the right since the process is represented as movement from left to right?,5 months ago,1759593330.233386,2,False,,2026-03-04 21:25:30
UgxMEBJ2qtFBCog4U9d4AaABAg,@ChristopherFonseka,"I disagree that the Air is less likely to steal customers away from the Pros. A lot of (but not all) Pro customers just want ""the best iPhone"", even if the don't truly need all that horsepower. Now, the title of ""best iPhone"" is a toss up between the most powerful, and the fancy new one that's the most eye catching

IMO it should be a battle between the Air and the Base model, but that's not what I'm seeing (at least in YouTube reviews)",5 months ago,1759593330.236097,0,False,,2026-03-04 21:25:30
Ugw6xWzH6HR9qSqwn7p4AaABAg,@Strawhat_Aadi,peak 0:08,5 months ago (edited),1759593330.238785,1,False,,2026-03-04 21:25:30
Ugx-BTxhfF-rr_QUaUl4AaABAg,@Talhahafeezqureshi,"Bro reviewed 
Iphone
Android
Meta
Something secret
And again Apple...

You okay bro ?",5 months ago,1759593330.241961,0,False,,2026-03-04 21:25:30
UgyINHU8jn0uS6mEI4B4AaABAg,@stealthjet19460,"Hi Arun! I know you probably won't see this but I absolutely love your videos! Whenever any new tech comes out, I scour your channel for the best reviews.. Stay Awesome!",5 months ago,1759593330.244565,0,False,,2026-03-04 21:25:30
Ugz988evn9xnNcTTZQl4AaABAg,@IAt0m1xI,"I disagree with you on the body scratch that everyone cares about the screen not the body

If I want to sell the phone do you really think anyone would buy it in a sorry state and the screen looks brand new??? Are you kidding me?

With your money you don't care, or actually destroy a 17 pro and sell it but make sure the screen is brand new and make a video for it.",5 months ago,1759593330.248363,0,False,,2026-03-04 21:25:30
Ugx_kC0tLyI9vkg2lTR4AaABAg,@Mohammad-g9r3l,2 sponsors in 1 vid?,5 months ago,1759593330.251378,1,False,,2026-03-04 21:25:30
UgyEYXy_cOz9Ru6e-o14AaABAg,@adarshgupta398,Wort upgrading from 14 pro ?,5 months ago,1759593330.254711,0,False,,2026-03-04 21:25:30
UgyGZ3ozSTiwXKrV9Nl4AaABAg,@k-ron7403,I’m sorry but the brutalist design of the Pros are hideous. I can’t stand them and I’m shocked they got signed off. I was looking to upgrade but I think I’ll have to go with the base model and skip the Pro model this year,5 months ago,1759593330.259701,2,False,,2026-03-04 21:25:30
UgxUlxmsUnTkFRdhwUx4AaABAg,@vikram5491,Pros went levels back in durability.,5 months ago,1759593330.263848,0,False,,2026-03-04 21:25:30
UgwNac1W3u122uEBkEd4AaABAg,@nhirani4829,Someone having an iPhone 15 Pro Max should upgrade or not?,5 months ago,1759593330.267363,0,False,,2026-03-04 21:25:30
Ugwx6Ezvx5yYiwJ1R4F4AaABAg,@oliviaharper7830,"I used to be very skeptical of Arun when i first started watching him but now I kinda enjoy his videos, like he has grown on me, the quality of his videos and the way he just enjoys going into detail and nuances of things is refreshing and inspiring, and you can actually tell he likes doing what he does for a living and when you're in that kinda zone you could care less what people think even if it gets many views or not because the satisfaction of having delivered the best according to your ability, the joy that brings to a creative person is the epitome of an innovative mind which is unmatchable and is what matters in the end. The way he did that TORRAS bit in the middle of the video and said ''it's engineered around people who like to capture their lives'' something about it clicked in me and inspired me to write this comment. I don't know how or why.",5 months ago,1759593330.270512,62,False,,2026-03-04 21:25:30
UgwNac1W3u122uEBkEd4AaABAg.ANNgNsAMkw_ANNgiFHVgS-,@RexplayzzOfficial,no,5 months ago,1759593330.624425,0,True,,2026-03-04 21:25:30
Ugwx6Ezvx5yYiwJ1R4F4AaABAg.ANNgMQRNElwANNh0HXfDG1,@J-Specter-c3h,That was an odd drive to write a comment but ok. His view is great,5 months ago,1759593330.938918,7,True,,2026-03-04 21:25:30
Ugwx6Ezvx5yYiwJ1R4F4AaABAg.ANNgMQRNElwANNhX8VB1Np,@torrasglobal, @J-Specter-c3h  can't agree more,5 months ago,1759593330.94199,3,True,,2026-03-04 21:25:30
Ugwx6Ezvx5yYiwJ1R4F4AaABAg.ANNgMQRNElwANNhuN2cyI2,@dengyanghaojia,I can completely relate to this feeling. Arun’s dedication to his project and the inspiration he brings us is boundless. Everyone who loves life can draw strength from both him and Dhrisha. Sending you my best wishes:face-red-heart-shape:,5 months ago,1759593330.944597,3,True,,2026-03-04 21:25:30
Ugwx6Ezvx5yYiwJ1R4F4AaABAg.ANNgMQRNElwANQqnOoO4fb,@rotcivikiasAKAsaiking,Exactly how i feel. But damn you know how to write 😂,5 months ago,1759593330.94744,2,True,,2026-03-04 21:25:30
UgwCycBj-GTSzwzPmvp4AaABAg,@AzeemKhan-lw9fz,The camera is good but is it the best we have to put it against vivo x200 ultra,5 months ago,1759593331.320088,0,False,,2026-03-04 21:25:31
Ugw3PLxBZb_I7xN6IJl4AaABAg,@paracli-vision,"""Somethings missing"" Yeah, Jony Ive. Another thing; they are hiring then firing junior engineers constantly, so don't expect anything cool for a few years.",5 months ago,1759593331.32308,1,False,,2026-03-04 21:25:31
Ugxq8mNr8rw0pPTsqSB4AaABAg,@kocomuv,"Wow, this review is so exciting! You always manage to break down the iPhone in a way that makes it feel brand new again. By the way, it just crossed my min, it's been a while since you did one of your amazing giveaways. With the year coming to a close, it would be so lovely if you could bless us with one again. No rush, of course, but it would really make many of us so happy. 😊",5 months ago,1759593331.3256,0,False,,2026-03-04 21:25:31
UgwDyGquSUnrCZzHTMp4AaABAg,@adityaistall5397,OMG 5 vids in 4 days. Hats off :face-blue-star-eyes:,5 months ago,1759593331.328079,0,False,,2026-03-04 21:25:31
UgzjJCu9AAJ5pm9ddN14AaABAg,@sadman253,Got the 17 pro after using a xs max for last 6 years.. idk about you but I'm very impressed with the upgrade..,5 months ago,1759593332.439239,22,False,,2026-03-04 21:25:32
Ugzji-v9h6XvJstVNb14AaABAg,@Unemployed_king2169,Clicked on this just to dislike it😂😂,5 months ago,1759593332.443668,0,False,,2026-03-04 21:25:32
UgziOD7CM7-tin05hLR4AaABAg,@kevvy22,What color is the move this year? Orange or Silver?,5 months ago,1759593332.447189,0,False,,2026-03-04 21:25:32
UgzNGwo10dpeRoIfU794AaABAg,@tafarapaul,Vapour chamber cannot handle Split Screen - amazing😅,5 months ago,1759593332.450367,3,False,,2026-03-04 21:25:32
Ugw7Bc0BLZJ4X7anDmp4AaABAg,@harrydestaffano565,"Elsewhere social media reports the new iPhones scratch easily and can be dented with a drop.  Arum, you are the expert, what is the truth???",5 months ago,1759593332.453086,0,False,,2026-03-04 21:25:32
Ugz4ReRL0HjUjdf_LiJ4AaABAg,@APtS_Gh0stHunt3R,I got a 16 pro max. My next upgrade will be the 20 pro max hahaha... I came from a 11pro max.,5 months ago (edited),1759593332.457289,0,False,,2026-03-04 21:25:32
Ugw00_U1Cvuaab3-kYl4AaABAg,@ise1199,EARLYYYYY,5 months ago,1759593332.46009,0,False,,2026-03-04 21:25:32
UgwgZxBHEaqrcvvIZct4AaABAg,@MaxRulesTheEarth,Hello,5 months ago,1759593332.463341,0,False,,2026-03-04 21:25:32
UgzptALJCIycz9dui3l4AaABAg,@helloworld_channel,"Cropping is not ""optical quality zoom"", what Apple is doing now is the most misleading advertising I’ve ever seen",5 months ago (edited),1759593332.465901,32,False,,2026-03-04 21:25:32
Ugy20qkGsS5G5uGxqQl4AaABAg,@Lightning_Dragon_,"When you tried the scratch test on the screen, Jerry Rig Everything had different results",5 months ago,1759593332.46971,0,False,,2026-03-04 21:25:32
UgzYED6dOb-KUi_0pTl4AaABAg,@shawn7544,Did you film this on a 17. It looks really good.,5 months ago,1759593332.472379,0,False,,2026-03-04 21:25:32
UgyUykhS0ddeywcHXVZ4AaABAg,@MihaiTutu19,Is there any good phone case? One that would cover the plateau…(not the cameras),5 months ago,1759593332.475485,0,False,,2026-03-04 21:25:32
UgzYNGWq0Zcr3XqrEjt4AaABAg,@SpencerLarson-wt4en,Investing in ts😤 but love your videos bro❤,5 months ago,1759593332.478356,1,False,,2026-03-04 21:25:32
UgzOsfy05TaovnHzY3d4AaABAg,@Gmanc22,16 pro max camera comparison is almost identical to the 17 imo,5 months ago,1759593332.481216,0,False,,2026-03-04 21:25:32
Ugx3b1scGNVavlD6k5h4AaABAg,@ry6270,The asterisk is..... A prominent feature of this video.... 😂,5 months ago,1759593332.485046,0,False,,2026-03-04 21:25:32
Ugx0F3eVW62rM-DdGcx4AaABAg,@raytaylor4199,"Yeah whatever, phones going to look like shit in a few weeks with the amount of scratches with or without a case.",5 months ago,1759593332.488106,0,False,,2026-03-04 21:25:32
UgzjJCu9AAJ5pm9ddN14AaABAg.ANNgInNIYb-ANNhJFjo7H-,@arshmanhassan8628,"i'll be ugrading from the iphone x, i'm sure the upgrade is a HUGE difference",5 months ago,1759593332.795287,5,True,,2026-03-04 21:25:32
UgzjJCu9AAJ5pm9ddN14AaABAg.ANNgInNIYb-ANNgrERGsiP,@ameralmutawa5017,"Upgrading after 6 years makes sense, but from 15 or 16 it's not worth it. I'm surprised Arun is inflating the features although they are not worth it for the price",5 months ago,1759593332.798456,4,True,,2026-03-04 21:25:32
UgzjJCu9AAJ5pm9ddN14AaABAg.ANNgInNIYb-ANP8f4rV-zq,@mmakeyboardwarrior4646,I commend you sir for using the XS until now,5 months ago,1759593332.802196,0,True,,2026-03-04 21:25:32
UgzptALJCIycz9dui3l4AaABAg.ANNgFPzaa5mANNnDPmtpoh,@alexeydanilchenko434,"They did not call it optical zoom - they said optical quality zoom. Big difference and is accurate enough not to be confused with pure optical or digital zoom. Courtesy of internet  this so called ""misleading"" issue is blown out of proportions way too much",5 months ago,1759593333.21892,6,True,,2026-03-04 21:25:33
UgzptALJCIycz9dui3l4AaABAg.ANNgFPzaa5mANNpsvXz5w0,@JustSenix, @alexeydanilchenko434 yeah I have the 8x and it def looks like it’s coming from another sensor,5 months ago,1759593333.221577,0,True,,2026-03-04 21:25:33
UgzptALJCIycz9dui3l4AaABAg.ANNgFPzaa5mANRY7plgLte,@vinceventresca6719," @alexeydanilchenko434 theres a comparison graphic on apples website that just says ""optical""",5 months ago,1759593333.224089,0,True,,2026-03-04 21:25:33
UgzptALJCIycz9dui3l4AaABAg.ANNgFPzaa5mANO6v0nNY03,@aka7kak8,"For reference - Using full frame lens on crop sensor digital full size  camera is actually an optical effect of a smaller sensor area, so I would argue if that is not optimal zoom effect.",5 months ago (edited),1759593333.226567,0,True,,2026-03-04 21:25:33
UgzptALJCIycz9dui3l4AaABAg.ANNgFPzaa5mANPjhvxq9bz,@kenmastersmaster,There's no actual optical zoom or what? Digital zoom is bullshit,5 months ago,1759593333.229038,0,True,,2026-03-04 21:25:33
UgwqYAqxg61msSqhbjJ4AaABAg,@dh7650,Where can you find the wallpaper at 3.01 ?,5 months ago,1759593334.272453,0,False,,2026-03-04 21:25:34
Ugw93oCH4H-AooApgmx4AaABAg,@frnckie,Complaining about something and making excuses for it is while.,5 months ago,1759593334.275076,2,False,,2026-03-04 21:25:34
UgwfiYmRMEzA4ZH8j_Z4AaABAg,@keremkubra1,How to feel 60hz screen to 90hz or 120hz What is your say the chance.,5 months ago,1759593334.277559,1,False,,2026-03-04 21:25:34
UgzPv22MUiCDEY-dX094AaABAg,@xtify07,1:24 bro casually captured Kash Patel,5 months ago,1759593334.280062,0,False,,2026-03-04 21:25:34
UgyoA4k7lXogJ9qesTJ4AaABAg,@andrus54,"With the new selfie camera, can you have your video be in landscape while keeping your phone upright?",5 months ago,1759593334.282519,0,False,,2026-03-04 21:25:34
UgzrLD0MGeS0Swdsfm54AaABAg,@its_jannick,how did i click a video and not get rickrolled,5 months ago,1759593334.28516,0,False,,2026-03-04 21:25:34
Ugz8VUZYYZfzo4I2yNJ4AaABAg,@AnthonyRiddle,The 17 pros look like gaming phones to me,5 months ago,1759593334.287671,1,False,,2026-03-04 21:25:34
UgyINepJ62ZFbHH-U2d4AaABAg,@zanzabar7878,"I really wanna get the base 17, but afraid apple will gimp the Ai features next year on it since it's the only 8gb ram model",5 months ago,1759593334.29014,0,False,,2026-03-04 21:25:34
Ugw440vbbUei8An3IUV4AaABAg,@dave-000,"At the end, we didn't find what Apple missed.",5 months ago,1759593334.292606,0,False,,2026-03-04 21:25:34
UgynmdMEkeowncejnUp4AaABAg,@yiftach_gross,I like your vids,5 months ago,1759593334.295074,0,False,,2026-03-04 21:25:34
UgyRjL-WOOy-tJtTlbF4AaABAg,@pmbuthia4210,I wish apple made the 17 plus with the features of the 17.  That would have ticked all my boxes and convinced me to move away from Android.,5 months ago,1759593334.29753,4,False,,2026-03-04 21:25:34
UgzukCWQ1F3gMW-bMul4AaABAg,@nite-winggaming945,I'll never be able to afford anything like this but im here for it😃,5 months ago (edited),1759593334.300499,1,False,,2026-03-04 21:25:34
UgxsXhE4kJJzbwVDwHV4AaABAg,@AviralGupta-ou1ti,jerry bro did it already di durability no need to u to do hahaha,5 months ago,1759593334.303014,1,False,,2026-03-04 21:25:34
Ugx9FZiPRA8jv3hnlWR4AaABAg,@Malkaboi,"Thank you Aaron , i have the 16 pro and the temptation never been higher to update this year.
But i fully understand that next year going to be big for iPhone’s and those the one’s to get.",5 months ago,1759593334.305487,1,False,,2026-03-04 21:25:34
Ugw2YC5GKJ9yguVOTyp4AaABAg,@rifqinor,7:30 Hades 2!,5 months ago,1759593334.307959,5,False,,2026-03-04 21:25:34
